{
  "$schema": "../../../../schemas/spec-dungeon-matrix.schema.json",
  "schemaVersion": 1,
  "recordType": "spec-dungeon-matrix",
  "id": "midnight-season-2/arms-warrior-utility-matrix",
  "status": "corroborated",
  "validity": { "fromBuild": "12.1.0.69587", "untilBuild": null, "seasonId": null, "seasonSlug": "midnight-season-2" },
  "spec": { "classId": 1, "className": "Warrior", "specId": 71, "specName": "Arms" },
  "axes": [
    { "id": "interrupt", "label": "Short-cooldown melee interrupt", "abilityNames": ["Pummel"], "spellIds": [6552], "toolIds": ["pummel"] },
    { "id": "spell-reflection", "label": "Self-only spell reflection and Magic mitigation", "abilityNames": ["Spell Reflection"], "spellIds": [23920], "toolIds": ["spell-reflection"] },
    { "id": "party-health-increase", "label": "Party temporary current and maximum health", "abilityNames": ["Rallying Cry"], "spellIds": [97462], "toolIds": ["rallying-cry"] },
    { "id": "control", "label": "Susceptible-enemy stops", "abilityNames": ["Shockwave", "Storm Bolt", "Intimidating Shout"], "spellIds": [46968, 107570, 5246], "toolIds": ["shockwave", "storm-bolt", "intimidating-shout"] },
    { "id": "self-fear-snare-removal", "label": "Self-only Fear and talent-dependent snare removal", "abilityNames": ["Berserker Rage"], "spellIds": [18499], "toolIds": ["berserker-rage"] },
    { "id": "self-toxin-curse-cleanse", "label": "Self-only Disease, Poison, and Curse removal", "abilityNames": ["Bitter Immunity"], "spellIds": [383762], "toolIds": ["bitter-immunity"] }
  ],
  "dungeons": [
    { "dungeonId": "altar-of-fangs", "instanceMapId": 2993, "ratings": { "interrupt": "always", "spell-reflection": "niche", "party-health-increase": "always", "control": "always", "self-fear-snare-removal": "always", "self-toxin-curse-cleanse": "always" }, "mechanicSpellIds": [1294569, 1296069, 1307567], "notes": ["Pummel handles interruptible casts and stuns provide non-lockout stops.", "Fearless can remove eligible Paralyzing Shots from the Warrior; Bitter Immunity is self-only backup for Regurgitate or Mass Envenom, not party cleanse coverage."] },
    { "dungeonId": "the-blinding-vale", "instanceMapId": 2859, "ratings": { "interrupt": "always", "spell-reflection": "niche", "party-health-increase": "always", "control": "always", "self-fear-snare-removal": "none", "self-toxin-curse-cleanse": "always" }, "mechanicSpellIds": [1250937, 1259365], "notes": ["Bitter Immunity can remove Toxic Spew only from the Warrior.", "Berserker Rage with Fearless removes snares, not Bloodthorn Roots; WHELP does not treat it as root freedom."] },
    { "dungeonId": "den-of-nalorakk", "instanceMapId": 2825, "ratings": { "interrupt": "always", "spell-reflection": "niche", "party-health-increase": "always", "control": "always", "self-fear-snare-removal": "always", "self-toxin-curse-cleanse": "always" }, "mechanicSpellIds": [1234846, 1309919], "notes": ["Bitter Immunity is a long-cooldown self answer to Toxic Spores.", "Fearless can remove an eligible snare such as Frigid Roar, but cannot replace group dispel coverage."] },
    { "dungeonId": "murder-row", "instanceMapId": 2813, "ratings": { "interrupt": "always", "spell-reflection": "niche", "party-health-increase": "always", "control": "always", "self-fear-snare-removal": "niche", "self-toxin-curse-cleanse": "always" }, "mechanicSpellIds": [1216590, 1217973, 1201554], "notes": ["Bitter Immunity can self-cleanse Heartstop Poison or Curse of Doom.", "Shockwave and other stops can interrupt susceptible Seduction channelers, but unlike Pummel they do not lock the spell school."] },
    { "dungeonId": "voidscar-arena", "instanceMapId": 2923, "ratings": { "interrupt": "always", "spell-reflection": "niche", "party-health-increase": "always", "control": "always", "self-fear-snare-removal": "always", "self-toxin-curse-cleanse": "always" }, "mechanicSpellIds": [1226031, 1263971, 1289258, 1249621], "notes": ["Bitter Immunity can remove the named Poisons from the Warrior and Fearless can remove eligible Violent Sand slowing.", "Reflectability is mechanic-specific; Spell Reflection remains personal Magic mitigation when a cast cannot be reflected."] },
    { "dungeonId": "temple-of-sethraliss", "instanceMapId": 1877, "ratings": { "interrupt": "always", "spell-reflection": "niche", "party-health-increase": "always", "control": "always", "self-fear-snare-removal": "niche", "self-toxin-curse-cleanse": "always" }, "mechanicSpellIds": [1290031, 1302153], "notes": ["Bitter Immunity is self-only backup for Poison or Curse mechanics.", "Shockwave, Storm Bolt, and Intimidating Shout affect only susceptible enemies and are not replacements for Pummel on lockout-sensitive casts."] },
    { "dungeonId": "kings-rest", "instanceMapId": 1762, "ratings": { "interrupt": "always", "spell-reflection": "niche", "party-health-increase": "always", "control": "always", "self-fear-snare-removal": "always", "self-toxin-curse-cleanse": "always" }, "mechanicSpellIds": [267273, 271564, 1306763], "notes": ["Bitter Immunity can self-cleanse Poison Nova, Lingering Fluid, or Serpent Strike; it cannot cleanse allies.", "Fearless provides self snare removal while stuns help control susceptible Animated Gold."] },
    { "dungeonId": "ruby-life-pools", "instanceMapId": 2521, "ratings": { "interrupt": "always", "spell-reflection": "niche", "party-health-increase": "always", "control": "always", "self-fear-snare-removal": "always", "self-toxin-curse-cleanse": "none" }, "mechanicSpellIds": [1305234], "notes": ["Fearless can remove eligible Cold Claws slowing from the Warrior.", "The guide names no Disease, Poison, or Curse requirement here; Bitter Immunity is not promoted to generic Magic cleansing."] }
  ],
  "affixes": [
    { "affixSlug": "xalataths-bargain-ascendant", "recommendations": ["Shockwave controls clustered orbs and Pummel or Storm Bolt can cover stragglers."] },
    { "affixSlug": "xalataths-bargain-voidbound", "recommendations": ["Wrecking Throw has special value against the absorption shield for damage specializations; swap immediately even without it."] },
    { "affixSlug": "xalataths-bargain-pulsar", "recommendations": ["Use Charge or Heroic Leap mobility to collect an orb without carrying it away from teammates."] },
    { "affixSlug": "xalataths-bargain-devour", "recommendations": ["Berserker Rage with Fearless can remove the Warrior's own eligible snare-classified application; this is self-only and does not solve the party's debuffs."] }
  ],
  "provenance": [{ "kind": "external-reference", "description": "Original structured summary of Archimtiros's Patch 12.1.0 Arms Warrior Mythic+ utility and affix guidance. The source repeats generic utility across dungeons, so canonical WHELP mechanic typing supplies examples without attributing invented encounter tips to the author.", "url": "https://www.wowhead.com/guide/classes/warrior/arms/mythic-plus-dungeon-tips", "retrievedAt": "2026-09-02T19:14:00+02:00" }]
}
