{
  "$schema": "../../../../schemas/spec-dungeon-matrix.schema.json",
  "schemaVersion": 1,
  "recordType": "spec-dungeon-matrix",
  "id": "midnight-season-2/outlaw-rogue-utility-matrix",
  "status": "corroborated",
  "validity": { "fromBuild": "12.1.0.69587", "untilBuild": null, "seasonId": null, "seasonSlug": "midnight-season-2" },
  "spec": { "classId": 4, "className": "Rogue", "specId": 260, "specName": "Outlaw" },
  "axes": [
    { "id": "interrupt", "label": "Short-cooldown melee spell-school interrupt", "abilityNames": ["Kick"], "spellIds": [1766], "toolIds": ["kick"] },
    { "id": "soothe", "label": "Enemy Enrage removal", "abilityNames": ["Shiv"], "spellIds": [5938], "toolIds": ["shiv"] },
    { "id": "route-stealth", "label": "Route-dependent group stealth", "abilityNames": ["Shroud of Concealment"], "spellIds": [114018], "toolIds": ["shroud-of-concealment"] },
    { "id": "single-target-control", "label": "Single-target stops", "abilityNames": ["Blind", "Kidney Shot"], "spellIds": [2094, 408], "toolIds": ["blind", "kidney-shot"] },
    { "id": "utility-poisons", "label": "Configured enemy output and healing modifiers", "abilityNames": ["Atrophic Poison", "Numbing Poison", "Wound Poison"], "spellIds": [381637, 5761, 8679], "toolIds": ["atrophic-poison", "numbing-poison", "wound-poison"] },
    { "id": "target-cancellation", "label": "Self-only targeted-mechanic cancellation", "abilityNames": ["Vanish"], "spellIds": [1856], "toolIds": ["vanish"] },
    { "id": "self-magic-cleanse", "label": "Self-only harmful spell-effect removal", "abilityNames": ["Cloak of Shadows"], "spellIds": [31224], "toolIds": ["cloak-of-shadows"] },
    { "id": "threat-transfer", "label": "Delayed threat transfer to one ally", "abilityNames": ["Tricks of the Trade"], "spellIds": [57934], "toolIds": ["tricks-of-the-trade"] }
  ],
  "dungeons": [
    { "dungeonId": "altar-of-fangs", "instanceMapId": 2993, "ratings": { "interrupt": "always", "soothe": "always", "route-stealth": "niche", "single-target-control": "always", "utility-poisons": "always", "target-cancellation": "niche", "self-magic-cleanse": "always", "threat-transfer": "niche" }, "mechanicSpellIds": [1294569, 1296069, 1307567, 1310666], "notes": ["Shiv removes Ravenous; Kick handles Piercing Hiss, Toxic Atrophy, and Mass Envenom, while Blind only delays a susceptible cast without a school lockout.", "Cloak is self-only protection from Ritual of the Fang or eligible debuffs; Shroud depends on the planned route."] },
    { "dungeonId": "the-blinding-vale", "instanceMapId": 2859, "ratings": { "interrupt": "always", "soothe": "none", "route-stealth": "niche", "single-target-control": "always", "utility-poisons": "always", "target-cancellation": "always", "self-magic-cleanse": "always", "threat-transfer": "niche" }, "mechanicSpellIds": [1259365, 1246607], "notes": ["Vanish can cancel selected beams or free the Rogue from Bloodthorn Roots, but it is not modeled as generic root or Magic removal.", "The guide identifies no Enrage target; Cloak remains self-only."] },
    { "dungeonId": "den-of-nalorakk", "instanceMapId": 2825, "ratings": { "interrupt": "always", "soothe": "always", "route-stealth": "niche", "single-target-control": "always", "utility-poisons": "always", "target-cancellation": "always", "self-magic-cleanse": "always", "threat-transfer": "niche" }, "mechanicSpellIds": [1234846, 1238053, 1246865, 1309919], "notes": ["Shiv removes Mother's Wrath or Bestial Wrath; Cloak can remove Toxic Spores from the Rogue.", "Vanish can escape the guide-named Glacial Tomb targeting, while Kick and single-target stops cover eligible casts."] },
    { "dungeonId": "murder-row", "instanceMapId": 2813, "ratings": { "interrupt": "always", "soothe": "always", "route-stealth": "niche", "single-target-control": "always", "utility-poisons": "always", "target-cancellation": "always", "self-magic-cleanse": "always", "threat-transfer": "niche" }, "mechanicSpellIds": [1201554, 1217973], "notes": ["Shiv removes Back to Work or Fel Rage and Kidney Shot controls susceptible first-boss targets.", "Cloak or Vanish can cancel selected Drain Life or Fel Missiles targeting, but neither provides party dispel coverage."] },
    { "dungeonId": "voidscar-arena", "instanceMapId": 2923, "ratings": { "interrupt": "always", "soothe": "always", "route-stealth": "niche", "single-target-control": "always", "utility-poisons": "always", "target-cancellation": "always", "self-magic-cleanse": "niche", "threat-transfer": "niche" }, "mechanicSpellIds": [1249621, 1226031, 1263971, 1289258], "notes": ["Shiv removes Feral Rage, Bloodsurge, or Bolster, although removing an Enrage can be strategically wrong when its downside benefits the party.", "Vanish can cancel selected Void Beam targeting; Kick remains the actual school lockout for deadly casts."] },
    { "dungeonId": "temple-of-sethraliss", "instanceMapId": 1877, "ratings": { "interrupt": "always", "soothe": "none", "route-stealth": "niche", "single-target-control": "always", "utility-poisons": "always", "target-cancellation": "always", "self-magic-cleanse": "always", "threat-transfer": "niche" }, "mechanicSpellIds": [1290031, 1302153], "notes": ["Vanish can cancel Latent Hex targeting and Cloak can remove eligible harmful spell effects from the Rogue.", "The guide names no Enrage target; control remains single-target unless a separate talent changes its delivery."] },
    { "dungeonId": "kings-rest", "instanceMapId": 1762, "ratings": { "interrupt": "always", "soothe": "none", "route-stealth": "niche", "single-target-control": "always", "utility-poisons": "always", "target-cancellation": "niche", "self-magic-cleanse": "niche", "threat-transfer": "niche" }, "mechanicSpellIds": [269935, 270901, 1296671], "notes": ["Kick or a single-target stop covers Hex Volley, Unholy Mending, Bind Soul, Wretched Discharge, or Hex when susceptible.", "No guide-backed Enrage interaction is asserted; Shroud remains route-planning utility rather than automatic skip coverage."] },
    { "dungeonId": "ruby-life-pools", "instanceMapId": 2521, "ratings": { "interrupt": "always", "soothe": "none", "route-stealth": "niche", "single-target-control": "always", "utility-poisons": "always", "target-cancellation": "always", "self-magic-cleanse": "always", "threat-transfer": "niche" }, "mechanicSpellIds": [1305234, 372808, 381515], "notes": ["Vanish can cancel selected Lightning Torrent targeting and Cloak can remove Lightning Rod or high Cold Claws stacks from the Rogue.", "Shiv has no Enrage target here; Blind can delay Ice Shield or Flaming Barrage but does not school-lock."] }
  ],
  "affixes": [
    { "affixSlug": "xalataths-bargain-ascendant", "recommendations": ["Kick can stop one orb, but Rogue has no baseline area crowd control and cannot cover a full wave alone."] },
    { "affixSlug": "xalataths-bargain-voidbound", "recommendations": ["Swap immediately to the priority enemy; Rogue supplies damage rather than a special group removal tool."] },
    { "affixSlug": "xalataths-bargain-pulsar", "recommendations": ["Sprint and other mobility help collect nearby orbs without abandoning the priority target."] },
    { "affixSlug": "xalataths-bargain-devour", "recommendations": ["Cloak of Shadows or Vanish can remove the Rogue's own application and Crimson Vial helps heal the absorb. Do not pre-immune the application when doing so would reduce the group's obtainable benefit."] }
  ],
  "provenance": [{ "kind": "external-reference", "description": "Original structured summary of JustGuy's Patch 12.1.0 Outlaw Rogue Mythic+ guidance. Its dungeon sections are comparatively compact; shared class interactions are constrained by canonical mechanics and the other current Rogue guides. WHELP stores compact recommendations and IDs rather than copied guide prose or talent strings.", "url": "https://www.wowhead.com/guide/classes/rogue/outlaw/mythic-plus-dungeon-tips", "retrievedAt": "2026-09-02T19:24:00+02:00" }]
}
