{
  "$schema": "../../../../schemas/spec-dungeon-matrix.schema.json",
  "schemaVersion": 1,
  "recordType": "spec-dungeon-matrix",
  "id": "midnight-season-2/arcane-mage-utility-matrix",
  "status": "corroborated",
  "validity": { "fromBuild": "12.1.0.69587", "untilBuild": null, "seasonId": null, "seasonSlug": "midnight-season-2" },
  "spec": { "classId": 8, "className": "Mage", "specId": 62, "specName": "Arcane" },
  "axes": [
    { "id": "target-drop", "label": "Target and channel cancellation", "abilityNames": ["Greater Invisibility"], "spellIds": [110959], "toolIds": ["greater-invisibility"] },
    { "id": "snare-removal", "label": "Personal snare removal", "abilityNames": ["Energized Barriers"], "spellIds": [386828], "toolIds": ["energized-barriers"] },
    { "id": "root-escape", "label": "Personal root and bond escape", "abilityNames": ["Blink"], "spellIds": [1953], "toolIds": ["blink"] },
    { "id": "decurse", "label": "Friendly Curse removal", "abilityNames": ["Remove Curse"], "spellIds": [475], "toolIds": ["remove-curse"] },
    { "id": "enemy-removal", "label": "Enemy Magic theft", "abilityNames": ["Spellsteal"], "spellIds": [30449], "toolIds": ["spellsteal"] },
    { "id": "control", "label": "Incapacitate and knock-up control", "abilityNames": ["Polymorph", "Supernova", "Ring of Frost"], "spellIds": [118, 157980, 113724], "toolIds": ["polymorph", "supernova", "ring-of-frost"] }
  ],
  "dungeons": [
    { "dungeonId": "altar-of-fangs", "instanceMapId": 2993, "ratings": { "target-drop": "always", "snare-removal": "always", "root-escape": "none", "decurse": "none", "enemy-removal": "none", "control": "niche" }, "mechanicSpellIds": [1294569, 1301413, 1307571], "notes": ["Energized Barriers removes Paralyzing Shots' snare component from the Mage.", "Greater Invisibility avoids selected Hatchling debuffs and Zul'jan's Boneslicer without causing the boss to retarget; line of sight Blood Sacrifice."] },
    { "dungeonId": "the-blinding-vale", "instanceMapId": 2859, "ratings": { "target-drop": "always", "snare-removal": "none", "root-escape": "always", "decurse": "none", "enemy-removal": "niche", "control": "niche" }, "mechanicSpellIds": [1238581, 1241058, 1259365], "notes": ["Spellsteal can take the beetles' Spiny Shield.", "Greater Invisibility or Blink escapes Bloodthorn Roots; Greater Invisibility also reduces the final boss's throw count during Thrash."] },
    { "dungeonId": "den-of-nalorakk", "instanceMapId": 2825, "ratings": { "target-drop": "always", "snare-removal": "none", "root-escape": "none", "decurse": "always", "enemy-removal": "none", "control": "none" }, "mechanicSpellIds": [1238801, 1309919], "notes": ["Remove Curse dispels Insatiable Hunger from an ally.", "Greater Invisibility breaks the Feast of Misery channel when the Mage is selected."] },
    { "dungeonId": "murder-row", "instanceMapId": 2813, "ratings": { "target-drop": "always", "snare-removal": "none", "root-escape": "none", "decurse": "always", "enemy-removal": "none", "control": "none" }, "mechanicSpellIds": [1214922, 1217973], "notes": ["Remove Curse answers Curse of Doom on the Mage or an ally.", "Greater Invisibility breaks selected Drain Life channels; Blink can cross Malefic Waves while carrying the Broom objective."] },
    { "dungeonId": "voidscar-arena", "instanceMapId": 2923, "ratings": { "target-drop": "always", "snare-removal": "none", "root-escape": "none", "decurse": "none", "enemy-removal": "none", "control": "none" }, "mechanicSpellIds": [1227197], "notes": ["Greater Invisibility cancels the final boss's Void Cascade targeting when timed for the Mage."] },
    { "dungeonId": "temple-of-sethraliss", "instanceMapId": 1877, "ratings": { "target-drop": "always", "snare-removal": "always", "root-escape": "always", "decurse": "none", "enemy-removal": "always", "control": "always" }, "mechanicSpellIds": [267027, 1290031, 1293307, 1293464], "notes": ["Spellsteal removes Accumulate Charge; Energized Barriers removes Slither Strike's snare.", "Greater Invisibility or Ring of Frost breaks Arrow Barrage, Blink escapes A Knot of Snakes, and Polymorph can break Temple Disruptor channels."] },
    { "dungeonId": "kings-rest", "instanceMapId": 1762, "ratings": { "target-drop": "always", "snare-removal": "always", "root-escape": "none", "decurse": "always", "enemy-removal": "always", "control": "always" }, "mechanicSpellIds": [269935, 270492, 1296671, 1298104], "notes": ["Spellsteal removes Bound by Shadow and Captain's Bulwark; Remove Curse answers Hex.", "Energized Barriers removes Frost Shock snares. Greater Invisibility cancels selected casts or channels and removes Dark Revelations; Ring of Frost controls susceptible leap and fear enemies."] },
    { "dungeonId": "ruby-life-pools", "instanceMapId": 2521, "ratings": { "target-drop": "none", "snare-removal": "none", "root-escape": "none", "decurse": "none", "enemy-removal": "always", "control": "none" }, "mechanicSpellIds": [373972, 391031], "notes": ["Spellsteal removes Blaze of Glory and Stormcloud Barrier; no dungeon-specific use is asserted for the other tracked axes."] }
  ],
  "affixes": [
    { "affixSlug": "xalataths-bargain-ascendant", "recommendations": ["Talent Supernova to interrupt a cluster of Ascendant casts."] },
    { "affixSlug": "xalataths-bargain-voidbound", "recommendations": ["Swap immediately and kill the Voidbound Emissary; no dedicated utility talent is required."] },
    { "affixSlug": "xalataths-bargain-pulsar", "recommendations": ["Use Mage mobility to collect partner orbs and aim your own orb toward an ally."] },
    { "affixSlug": "xalataths-bargain-devour", "recommendations": ["Remove Curse clears the eligible effect from the Mage or an ally; Energized Barriers provides a self-only alternative through the affix's snare component."] }
  ],
  "provenance": [{ "kind": "external-reference", "description": "Original structured summary of Porom's Patch 12.1.0 Arcane Mage dungeon utility and affix recommendations. Talent strings, gear, and performance rankings are intentionally excluded.", "url": "https://www.wowhead.com/guide/classes/mage/arcane/mythic-plus-dungeon-tips", "retrievedAt": "2026-09-02T18:02:00+02:00" }]
}
