{
  "$schema": "../../../../schemas/spec-dungeon-matrix.schema.json", "schemaVersion": 1, "recordType": "spec-dungeon-matrix",
  "id": "midnight-season-2/preservation-evoker-utility-matrix", "status": "corroborated",
  "validity": { "fromBuild": "12.1.0.69587", "untilBuild": null, "seasonId": null, "seasonSlug": "midnight-season-2" },
  "spec": { "classId": 13, "className": "Evoker", "specId": 1468, "specName": "Preservation" },
  "axes": [
    { "id": "interrupt", "label": "Spell-school interrupt", "abilityNames": ["Quell"], "spellIds": [351338], "toolIds": ["quell"] },
    { "id": "magic-toxin-cleanse", "label": "Friendly Magic and Poison removal", "abilityNames": ["Naturalize", "Cauterizing Flame"], "spellIds": [360823, 374251], "toolIds": ["naturalize", "cauterizing-flame"] },
    { "id": "multi-cleanse", "label": "Friendly Bleed, Curse, or Disease removal", "abilityNames": ["Cauterizing Flame"], "spellIds": [374251], "toolIds": ["cauterizing-flame"] },
    { "id": "soothe", "label": "Enemy Enrage removal", "abilityNames": ["Oppressing Roar with Overawe"], "spellIds": [372048], "toolIds": ["oppressing-roar-overawe"] },
    { "id": "area-control", "label": "Susceptibility-dependent stops", "abilityNames": ["Tail Swipe", "Wing Buffet", "Sleep Walk"], "spellIds": [368970, 357214, 360806], "toolIds": ["tail-swipe", "wing-buffet", "sleep-walk"] },
    { "id": "party-defense", "label": "Party AoE mitigation", "abilityNames": ["Zephyr"], "spellIds": [374227], "toolIds": ["zephyr"] },
    { "id": "ally-movement", "label": "Single-ally movement support", "abilityNames": ["Rescue", "Spatial Paradox"], "spellIds": [370665, 406732], "toolIds": ["rescue", "spatial-paradox"] },
    { "id": "group-movement", "label": "Group movement support", "abilityNames": ["Time Spiral"], "spellIds": [374968], "toolIds": ["time-spiral"] },
    { "id": "ally-defense", "label": "Single-ally damage staggering", "abilityNames": ["Time Dilation"], "spellIds": [357170], "toolIds": ["time-dilation"] }
  ],
  "dungeons": [
    { "dungeonId": "altar-of-fangs", "instanceMapId": 2993, "ratings": { "interrupt": "always", "magic-toxin-cleanse": "always", "multi-cleanse": "always", "soothe": "always", "area-control": "always", "party-defense": "always", "ally-movement": "niche", "group-movement": "niche", "ally-defense": "always" }, "mechanicSpellIds": [1294569, 1296069, 1306308], "notes": ["Naturalize removes Magic Paralyzing Shots, Cauterizing Flame removes Disease Regurgitate, and Overawe removes Ravenous Claws' Enrage.", "The live guide's Altar subsection contains stale unrelated examples; WHELP uses only dungeon-matched canonical mechanics."] },
    { "dungeonId": "the-blinding-vale", "instanceMapId": 2859, "ratings": { "interrupt": "always", "magic-toxin-cleanse": "always", "multi-cleanse": "always", "soothe": "always", "area-control": "always", "party-defense": "always", "ally-movement": "niche", "group-movement": "niche", "ally-defense": "always" }, "mechanicSpellIds": [], "notes": ["The guide identifies Flanking Spear and Infected Pinions for Cauterizing Flame and Blood Frenzy for Overawe, but their IDs are not joined until canonical dungeon records corroborate them.", "Naturalize remains Preservation's short-cooldown Magic and Poison dispel."] },
    { "dungeonId": "den-of-nalorakk", "instanceMapId": 2825, "ratings": { "interrupt": "always", "magic-toxin-cleanse": "always", "multi-cleanse": "always", "soothe": "none", "area-control": "always", "party-defense": "always", "ally-movement": "niche", "group-movement": "niche", "ally-defense": "always" }, "mechanicSpellIds": [1309919], "notes": ["Cauterizing Flame provides the guide's Curse answer; no current Enrage target is modeled.", "Zephyr applies only to area damage, while Time Dilation staggers damage on one ally and does not count as party mitigation."] },
    { "dungeonId": "murder-row", "instanceMapId": 2813, "ratings": { "interrupt": "always", "magic-toxin-cleanse": "always", "multi-cleanse": "always", "soothe": "always", "area-control": "always", "party-defense": "always", "ally-movement": "niche", "group-movement": "niche", "ally-defense": "always" }, "mechanicSpellIds": [1201554, 1229433], "notes": ["Naturalize removes friendly Magic effects, while Cauterizing Flame covers eligible Bleeds and Curse of Doom without removing Magic.", "The current guide identifies Ephemeral Bloodlust as an Overawe target and Throw Axe as a Cauterizing Flame target."] },
    { "dungeonId": "voidscar-arena", "instanceMapId": 2923, "ratings": { "interrupt": "always", "magic-toxin-cleanse": "always", "multi-cleanse": "always", "soothe": "always", "area-control": "always", "party-defense": "always", "ally-movement": "niche", "group-movement": "niche", "ally-defense": "always" }, "mechanicSpellIds": [1249238, 1249621, 1250043], "notes": ["Naturalize removes player Magic debuffs such as Fire Spit or Melt Armor; Quell interrupts Violent Sand.", "Cauterizing Flame does not remove Magic. The guide's Bleed and Enrage suggestions remain unjoined where canonical spell IDs are absent."] },
    { "dungeonId": "temple-of-sethraliss", "instanceMapId": 1877, "ratings": { "interrupt": "always", "magic-toxin-cleanse": "always", "multi-cleanse": "always", "soothe": "none", "area-control": "always", "party-defense": "always", "ally-movement": "niche", "group-movement": "niche", "ally-defense": "always" }, "mechanicSpellIds": [267027, 1293307, 1308100, 1308148], "notes": ["Naturalize handles Magic and Poison effects; Quell covers priority casts, while Tail Swipe, Wing Buffet, and Sleep Walk stop susceptible channels.", "Mechanics from an unrelated dungeon misplaced in this guide subsection are intentionally excluded."] },
    { "dungeonId": "kings-rest", "instanceMapId": 1762, "ratings": { "interrupt": "always", "magic-toxin-cleanse": "always", "multi-cleanse": "always", "soothe": "none", "area-control": "niche", "party-defense": "always", "ally-movement": "niche", "group-movement": "niche", "ally-defense": "always" }, "mechanicSpellIds": [269935, 269976, 270901, 271564, 1296671, 1298104, 1306763], "notes": ["Naturalize, Cauterizing Flame, and Quell cover distinct friendly-dispel and interrupt domains; Sleep Walk has limited value against Undead.", "Do not remove Ancestral Fury simply because Overawe can Soothe it: its linked vulnerability benefits group damage."] },
    { "dungeonId": "ruby-life-pools", "instanceMapId": 2521, "ratings": { "interrupt": "always", "magic-toxin-cleanse": "always", "multi-cleanse": "none", "soothe": "none", "area-control": "always", "party-defense": "always", "ally-movement": "niche", "group-movement": "niche", "ally-defense": "always" }, "mechanicSpellIds": [], "notes": ["Naturalize retains healer dispel value, but the current guide's unrelated-instance cleanse and Enrage examples are excluded.", "Quell, control, Zephyr, Time Dilation, and movement support remain generally useful without unsupported mechanic joins."] }
  ],
  "affixes": [
    { "affixSlug": "xalataths-bargain-ascendant", "recommendations": ["Quell covers one cast while Tail Swipe and Wing Buffet stop clustered orbs; the latter remain crowd-control rather than school interrupts."] },
    { "affixSlug": "xalataths-bargain-voidbound", "recommendations": ["No dedicated utility shortcut is sourced; contribute damage while maintaining healing coverage."] },
    { "affixSlug": "xalataths-bargain-pulsar", "recommendations": ["Time Spiral, Spatial Paradox, and Rescue offer distinct partner-movement support; respect the Time Spiral and Spatial Paradox choice node."] },
    { "affixSlug": "xalataths-bargain-devour", "recommendations": ["Naturalize removes Magic or Poison shields and Cauterizing Flame removes eligible non-Magic shields; neither substitutes for the other domains."] }
  ],
  "provenance": [{ "kind": "external-reference", "description": "Original structured summary of Voulk's Patch 12.1.0 Preservation dungeon and affix guidance, excluding misplaced unrelated-dungeon fragments and joining only canonical spell identities.", "url": "https://www.wowhead.com/guide/classes/evoker/preservation/mythic-plus-dungeon-tips", "retrievedAt": "2026-09-02T20:35:00+02:00" }]
}
