{
  "$schema": "../../../../schemas/spec-dungeon-matrix.schema.json",
  "schemaVersion": 1,
  "recordType": "spec-dungeon-matrix",
  "id": "midnight-season-2/shadow-priest-utility-matrix",
  "status": "corroborated",
  "validity": { "fromBuild": "12.1.0.69587", "untilBuild": null, "seasonId": null, "seasonSlug": "midnight-season-2" },
  "spec": { "classId": 5, "className": "Priest", "specId": 258, "specName": "Shadow" },
  "axes": [
    { "id": "friendly-magic-removal", "label": "Area friendly Magic removal", "abilityNames": ["Mass Dispel"], "spellIds": [32375], "toolIds": ["mass-dispel"] },
    { "id": "enemy-magic-removal", "label": "Single-target and area enemy Magic removal", "abilityNames": ["Dispel Magic", "Mass Dispel"], "spellIds": [528, 32375], "toolIds": ["dispel-magic", "mass-dispel"] },
    { "id": "disease-cleanse", "label": "Friendly Disease removal", "abilityNames": ["Purify Disease"], "spellIds": [213634], "toolIds": ["purify-disease"] },
    { "id": "mind-control", "label": "Eligible enemy temporary control", "abilityNames": ["Dominate Mind"], "spellIds": [205364], "toolIds": ["dominate-mind"] },
    { "id": "detection-reduction", "label": "Humanoid and Dragonkin detection-range reduction", "abilityNames": ["Mind Soothe"], "spellIds": [453], "toolIds": ["mind-soothe"] },
    { "id": "self-movement-freedom", "label": "Self-only root and snare immunity", "abilityNames": ["Dispersion"], "spellIds": [47585], "toolIds": ["dispersion"] }
  ],
  "dungeons": [
    { "dungeonId": "altar-of-fangs", "instanceMapId": 2993, "ratings": { "friendly-magic-removal": "always", "enemy-magic-removal": "none", "disease-cleanse": "always", "mind-control": "niche", "detection-reduction": "niche", "self-movement-freedom": "none" }, "mechanicSpellIds": [1294569, 1296069], "notes": ["Mass Dispel removes multi-target Paralyzing Shots, while Purify Disease removes Regurgitate after a failed Rav'i frontal.", "Dominate Mind can stop eligible Humanoid or Dragonkin casts and Mind Soothe can enable route-dependent skips, but the guide does not yet assert a stable target or route."] },
    { "dungeonId": "the-blinding-vale", "instanceMapId": 2859, "ratings": { "friendly-magic-removal": "always", "enemy-magic-removal": "none", "disease-cleanse": "none", "mind-control": "niche", "detection-reduction": "niche", "self-movement-freedom": "always" }, "mechanicSpellIds": [1259365], "notes": ["Mass Dispel removes Bloodthorn Roots from multiple players. Dispersion is a self-only fallback that removes or immunes the root while active.", "Dominate Mind and Mind Soothe remain route-dependent on eligible creature types rather than universal dungeon answers."] },
    { "dungeonId": "den-of-nalorakk", "instanceMapId": 2825, "ratings": { "friendly-magic-removal": "always", "enemy-magic-removal": "always", "disease-cleanse": "none", "mind-control": "niche", "detection-reduction": "niche", "self-movement-freedom": "none" }, "mechanicSpellIds": [1235549, 1239860, 1297696], "notes": ["Mass Dispel removes harmful Cryo Surge and Glacial Torment effects and can offensively remove the eligible Healing Breeze buff.", "Dominate Mind and Mind Soothe are exploratory, creature-restricted route tools; no Disease application is listed."] },
    { "dungeonId": "murder-row", "instanceMapId": 2813, "ratings": { "friendly-magic-removal": "always", "enemy-magic-removal": "none", "disease-cleanse": "none", "mind-control": "niche", "detection-reduction": "niche", "self-movement-freedom": "none" }, "mechanicSpellIds": [1201554, 1217633, 1228198], "notes": ["Mass Dispel removes Seduction after a missed stop and handles Corroding Spittle on the mana wyrms and Kystia encounter.", "Dominate Mind and Mind Soothe may affect eligible Humanoids, but no stable target or skip is asserted until route evidence exists."] },
    { "dungeonId": "voidscar-arena", "instanceMapId": 2923, "ratings": { "friendly-magic-removal": "always", "enemy-magic-removal": "none", "disease-cleanse": "none", "mind-control": "niche", "detection-reduction": "none", "self-movement-freedom": "none" }, "mechanicSpellIds": [1250043], "notes": ["Mass Dispel is backup friendly Magic removal for Melt Armor when the healer cannot cover it.", "Dominate Mind can temporarily stop an eligible non-Demonic, non-Mechanical, non-Undead target. Mind Soothe does not apply to the dungeon's Aberrations, so it is not route coverage here."] },
    { "dungeonId": "temple-of-sethraliss", "instanceMapId": 1877, "ratings": { "friendly-magic-removal": "always", "enemy-magic-removal": "always", "disease-cleanse": "none", "mind-control": "niche", "detection-reduction": "niche", "self-movement-freedom": "none" }, "mechanicSpellIds": [1296052], "notes": ["Mass Dispel removes Imbued Conduction and has additional offensive Magic-removal value, although the guide does not name those enemy buffs.", "Dominate Mind and Mind Soothe remain eligible-creature and route dependent; no Disease application is listed."] },
    { "dungeonId": "kings-rest", "instanceMapId": 1762, "ratings": { "friendly-magic-removal": "always", "enemy-magic-removal": "always", "disease-cleanse": "none", "mind-control": "none", "detection-reduction": "none", "self-movement-freedom": "none" }, "mechanicSpellIds": [269935, 270901, 1296671], "notes": ["Mass Dispel covers the named player dispel and offensively removes Bound by Shadow, Captain's Bulwark, and Unholy Mending; removing Bound by Shadow immediately kills the affected Minion of Zul.", "Dominate Mind does not work on Undead beings, and Mind Soothe does not affect Undead, so neither is treated as King's Rest route coverage."] },
    { "dungeonId": "ruby-life-pools", "instanceMapId": 2521, "ratings": { "friendly-magic-removal": "always", "enemy-magic-removal": "always", "disease-cleanse": "none", "mind-control": "niche", "detection-reduction": "niche", "self-movement-freedom": "none" }, "mechanicSpellIds": [373972, 381515, 391031, 392641, 1305234], "notes": ["Mass Dispel can cover Cold Claws, Stormslam, and paired Rolling Thunder applications when the healer needs help.", "Dispel Magic or Mass Dispel removes Blaze of Glory and Stormcloud Barrier; Dominate Mind and Mind Soothe remain target- and route-dependent on eligible enemies."] }
  ],
  "affixes": [
    { "affixSlug": "xalataths-bargain-ascendant", "recommendations": ["Psychic Scream controls clustered orbs and Mass Dispel removes up to five enemy Magic effects; these are control and purge interactions, not friendly cleansing."] },
    { "affixSlug": "xalataths-bargain-voidbound", "recommendations": ["Swap immediately to the emissary and use Shadow Word: Death against its one remaining health after the shield is depleted."] },
    { "affixSlug": "xalataths-bargain-pulsar", "recommendations": ["Move predictably with your orbiting orb and collect another player's orb."] },
    { "affixSlug": "xalataths-bargain-devour", "recommendations": ["Mass Dispel can clear the party in an emergency; Purify Disease can remove two individual applications during the duration, while healing remains the fallback."] }
  ],
  "provenance": [{ "kind": "external-reference", "description": "Original structured summary of EllipsisPriest's Patch 12.1.0 Shadow Priest dungeon utility and affix recommendations. Talent strings, gear, rankings, and comments are intentionally excluded; exploratory Dominate Mind and Mind Soothe ideas remain niche unless a target or route is explicitly supported.", "url": "https://www.wowhead.com/guide/classes/priest/shadow/mythic-plus-dungeon-tips", "retrievedAt": "2026-09-02T18:52:46+02:00" }]
}
